{
  "archlens-plan": "1.0",
  "base": "architecture",
  "baseHash": "sha256:2a0ce5886eb24e325052886e7df1d968fd93f30f86e83900cb780537df94d4c0",
  "created": "2026-10-04",
  "delta": {
    "archlens-delta": "1.0",
    "source": {
      "kind": "prompt",
      "ref": "visões de impacto do exemplo"
    },
    "summary": "Visões de impacto de pedidos, pagamentos e infraestrutura",
    "views": [
      {
        "key": "impacto-pedidos",
        "notation": "archimate",
        "viewpoint": "impact",
        "anchor": "loja.pedidos",
        "title": "Impacto de Pedidos"
      },
      {
        "key": "impacto-pagamentos",
        "notation": "archimate",
        "viewpoint": "impact",
        "anchor": "financeiro.pagamentos",
        "title": "Impacto de Pagamentos"
      },
      {
        "key": "impacto-infra",
        "notation": "archimate",
        "viewpoint": "impact",
        "anchor": "infra-cloud",
        "title": "Impacto da Infraestrutura"
      }
    ]
  },
  "items": [
    {
      "n": 1,
      "key": "view:impacto-pedidos",
      "class": "new",
      "kind": "view",
      "target": "impacto-pedidos"
    },
    {
      "n": 2,
      "key": "view:impacto-pagamentos",
      "class": "new",
      "kind": "view",
      "target": "impacto-pagamentos"
    },
    {
      "n": 3,
      "key": "view:impacto-infra",
      "class": "new",
      "kind": "view",
      "target": "impacto-infra"
    }
  ],
  "summary": {
    "new": 3
  },
  "blocked": false,
  "errors": []
}
