{
  "archlens-plan": "1.0",
  "base": "architecture",
  "baseHash": "sha256:d7520ee6d7a6f6ede36ee60c7f4f6b7a5ea1a83fe31f586cc739484367205dda",
  "created": "2026-10-04",
  "delta": {
    "archlens-delta": "1.0",
    "source": {
      "kind": "repo",
      "ref": "/home/rodrigo/repos/github.com/expersoft/archlens/examples/repos/infra@766f5ce"
    },
    "summary": "Leitura de infra@766f5ce",
    "model": {
      "elements": [
        {
          "id": "infra-cloud",
          "type": "c4:softwareSystem",
          "name": "infra",
          "properties": {
            "repo": "/home/rodrigo/repos/github.com/expersoft/archlens/examples/repos/infra",
            "repoRole": "system"
          },
          "sources": [
            {
              "kind": "repo",
              "ref": "/home/rodrigo/repos/github.com/expersoft/archlens/examples/repos/infra@766f5ce",
              "path": ".",
              "line": 1
            }
          ]
        },
        {
          "id": "infra-cloud.pedidos",
          "type": "c4:container",
          "parent": "infra-cloud",
          "name": "pedidos",
          "technology": "aws_db_instance",
          "tags": [
            "database"
          ],
          "sources": [
            {
              "kind": "repo",
              "ref": "/home/rodrigo/repos/github.com/expersoft/archlens/examples/repos/infra@766f5ce",
              "path": "main.tf",
              "line": 1
            }
          ]
        },
        {
          "id": "infra-cloud.eventos",
          "type": "c4:container",
          "parent": "infra-cloud",
          "name": "eventos",
          "technology": "aws_msk_cluster",
          "tags": [
            "queue"
          ],
          "sources": [
            {
              "kind": "repo",
              "ref": "/home/rodrigo/repos/github.com/expersoft/archlens/examples/repos/infra@766f5ce",
              "path": "main.tf",
              "line": 8
            }
          ]
        },
        {
          "id": "tech.aws-eks-cluster-principal",
          "type": "archimate:node",
          "name": "principal",
          "technology": "aws_eks_cluster",
          "sources": [
            {
              "kind": "repo",
              "ref": "/home/rodrigo/repos/github.com/expersoft/archlens/examples/repos/infra@766f5ce",
              "path": "main.tf",
              "line": 17
            }
          ]
        }
      ],
      "relationships": [
        {
          "from": "infra-cloud.eventos",
          "to": "tech.aws-eks-cluster-principal",
          "type": "archimate:serving",
          "sources": [
            {
              "kind": "repo",
              "ref": "/home/rodrigo/repos/github.com/expersoft/archlens/examples/repos/infra@766f5ce",
              "path": "main.tf",
              "line": 17
            }
          ]
        }
      ]
    }
  },
  "items": [
    {
      "n": 1,
      "key": "el:infra-cloud",
      "class": "new",
      "kind": "element",
      "target": "infra-cloud",
      "type": "c4:softwareSystem",
      "name": "infra",
      "parent": null
    },
    {
      "n": 2,
      "key": "el:infra-cloud.pedidos",
      "class": "new",
      "kind": "element",
      "target": "infra-cloud.pedidos",
      "type": "c4:container",
      "name": "pedidos",
      "parent": "infra-cloud"
    },
    {
      "n": 3,
      "key": "el:infra-cloud.eventos",
      "class": "new",
      "kind": "element",
      "target": "infra-cloud.eventos",
      "type": "c4:container",
      "name": "eventos",
      "parent": "infra-cloud"
    },
    {
      "n": 4,
      "key": "el:tech.aws-eks-cluster-principal",
      "class": "new",
      "kind": "element",
      "target": "tech.aws-eks-cluster-principal",
      "type": "archimate:node",
      "name": "principal",
      "parent": null
    },
    {
      "n": 5,
      "key": "rel:0",
      "class": "new",
      "kind": "relationship",
      "target": "infra-cloud.eventos-serving-tech.aws-eks-cluster-principal",
      "from": "infra-cloud.eventos",
      "to": "tech.aws-eks-cluster-principal",
      "type": "archimate:serving"
    }
  ],
  "summary": {
    "new": 5
  },
  "blocked": false,
  "errors": []
}
