{
  "archlens-plan": "1.0",
  "base": "architecture",
  "baseHash": "none",
  "created": "2026-10-04",
  "delta": {
    "archlens-delta": "1.0",
    "source": {
      "kind": "repo",
      "ref": "/home/rodrigo/repos/github.com/expersoft/archlens/examples/repos/pedidos@766f5ce"
    },
    "summary": "Leitura de pedidos@766f5ce",
    "model": {
      "elements": [
        {
          "id": "loja",
          "type": "c4:softwareSystem",
          "name": "loja",
          "sources": [
            {
              "kind": "repo",
              "ref": "/home/rodrigo/repos/github.com/expersoft/archlens/examples/repos/pedidos@766f5ce",
              "path": ".",
              "line": 1
            }
          ]
        },
        {
          "id": "loja.pedidos",
          "type": "c4:container",
          "parent": "loja",
          "name": "pedidos",
          "aliases": [
            "pedidos-api"
          ],
          "properties": {
            "repo": "/home/rodrigo/repos/github.com/expersoft/archlens/examples/repos/pedidos",
            "repoRole": "service"
          },
          "sources": [
            {
              "kind": "repo",
              "ref": "/home/rodrigo/repos/github.com/expersoft/archlens/examples/repos/pedidos@766f5ce",
              "path": ".",
              "line": 1
            }
          ]
        },
        {
          "id": "loja.pedidos-pedidos-db",
          "type": "c4:container",
          "parent": "loja",
          "name": "pedidos-db",
          "tags": [
            "database"
          ],
          "sources": [
            {
              "kind": "repo",
              "ref": "/home/rodrigo/repos/github.com/expersoft/archlens/examples/repos/pedidos@766f5ce",
              "path": "docker-compose.yml",
              "line": 13
            }
          ]
        },
        {
          "id": "tech.postgres-16",
          "type": "archimate:system-software",
          "name": "PostgreSQL 16",
          "sources": [
            {
              "kind": "repo",
              "ref": "/home/rodrigo/repos/github.com/expersoft/archlens/examples/repos/pedidos@766f5ce",
              "path": "docker-compose.yml",
              "line": 13
            }
          ]
        },
        {
          "id": "ext.pagamentos",
          "type": "c4:softwareSystem",
          "name": "pagamentos",
          "external": true,
          "inferred": true,
          "confidence": "baixa",
          "sources": [
            {
              "kind": "repo",
              "ref": "/home/rodrigo/repos/github.com/expersoft/archlens/examples/repos/pedidos@766f5ce",
              "path": "docker-compose.yml",
              "line": 7,
              "excerpt": "host em PAGAMENTOS_URL"
            }
          ]
        },
        {
          "id": "loja.pedidos.api-api-de-pedidos",
          "type": "archimate:application-interface",
          "name": "API de Pedidos",
          "properties": {
            "version": "1.4.0",
            "operations": 3
          },
          "sources": [
            {
              "kind": "repo",
              "ref": "/home/rodrigo/repos/github.com/expersoft/archlens/examples/repos/pedidos@766f5ce",
              "path": "api/openapi.yaml",
              "line": 3
            }
          ]
        },
        {
          "id": "topic.pedido-criado",
          "type": "c4:container",
          "name": "pedido-criado",
          "tags": [
            "topic"
          ],
          "sources": [
            {
              "kind": "repo",
              "ref": "/home/rodrigo/repos/github.com/expersoft/archlens/examples/repos/pedidos@766f5ce",
              "path": "api/asyncapi.yaml",
              "line": 5
            }
          ]
        }
      ],
      "relationships": [
        {
          "from": "tech.postgres-16",
          "to": "loja.pedidos-pedidos-db",
          "type": "archimate:realization",
          "sources": [
            {
              "kind": "repo",
              "ref": "/home/rodrigo/repos/github.com/expersoft/archlens/examples/repos/pedidos@766f5ce",
              "path": "docker-compose.yml",
              "line": 13
            }
          ]
        },
        {
          "from": "loja.pedidos",
          "to": "loja.pedidos-pedidos-db",
          "type": "uses",
          "description": "depends_on",
          "sources": [
            {
              "kind": "repo",
              "ref": "/home/rodrigo/repos/github.com/expersoft/archlens/examples/repos/pedidos@766f5ce",
              "path": "docker-compose.yml",
              "line": 11
            }
          ]
        },
        {
          "from": "loja.pedidos",
          "to": "ext.pagamentos",
          "type": "uses",
          "description": "via PAGAMENTOS_URL",
          "inferred": true,
          "sources": [
            {
              "kind": "repo",
              "ref": "/home/rodrigo/repos/github.com/expersoft/archlens/examples/repos/pedidos@766f5ce",
              "path": "docker-compose.yml",
              "line": 7,
              "excerpt": "PAGAMENTOS_URL → pagamentos"
            }
          ]
        },
        {
          "from": "loja.pedidos",
          "to": "loja.pedidos.api-api-de-pedidos",
          "type": "archimate:realization",
          "sources": [
            {
              "kind": "repo",
              "ref": "/home/rodrigo/repos/github.com/expersoft/archlens/examples/repos/pedidos@766f5ce",
              "path": "api/openapi.yaml",
              "line": 3
            }
          ]
        },
        {
          "from": "loja.pedidos",
          "to": "topic.pedido-criado",
          "type": "archimate:flow",
          "description": "publica PedidoCriado",
          "sources": [
            {
              "kind": "repo",
              "ref": "/home/rodrigo/repos/github.com/expersoft/archlens/examples/repos/pedidos@766f5ce",
              "path": "api/asyncapi.yaml",
              "line": 5
            }
          ]
        }
      ]
    }
  },
  "items": [
    {
      "n": 1,
      "key": "el:loja",
      "class": "new",
      "kind": "element",
      "target": "loja",
      "type": "c4:softwareSystem",
      "name": "loja",
      "parent": null
    },
    {
      "n": 2,
      "key": "el:loja.pedidos",
      "class": "new",
      "kind": "element",
      "target": "loja.pedidos",
      "type": "c4:container",
      "name": "pedidos",
      "parent": "loja"
    },
    {
      "n": 3,
      "key": "el:loja.pedidos-pedidos-db",
      "class": "new",
      "kind": "element",
      "target": "loja.pedidos-pedidos-db",
      "type": "c4:container",
      "name": "pedidos-db",
      "parent": "loja"
    },
    {
      "n": 4,
      "key": "el:tech.postgres-16",
      "class": "new",
      "kind": "element",
      "target": "tech.postgres-16",
      "type": "archimate:system-software",
      "name": "PostgreSQL 16",
      "parent": null
    },
    {
      "n": 5,
      "key": "el:ext.pagamentos",
      "class": "new",
      "kind": "element",
      "target": "ext.pagamentos",
      "type": "c4:softwareSystem",
      "name": "pagamentos",
      "parent": null
    },
    {
      "n": 6,
      "key": "el:loja.pedidos.api-api-de-pedidos",
      "class": "new",
      "kind": "element",
      "target": "loja.pedidos.api-api-de-pedidos",
      "type": "archimate:application-interface",
      "name": "API de Pedidos",
      "parent": null
    },
    {
      "n": 7,
      "key": "el:topic.pedido-criado",
      "class": "new",
      "kind": "element",
      "target": "topic.pedido-criado",
      "type": "c4:container",
      "name": "pedido-criado",
      "parent": null
    },
    {
      "n": 8,
      "key": "rel:0",
      "class": "new",
      "kind": "relationship",
      "target": "tech.postgres-16-realization-loja.pedidos-pedidos-db",
      "from": "tech.postgres-16",
      "to": "loja.pedidos-pedidos-db",
      "type": "archimate:realization"
    },
    {
      "n": 9,
      "key": "rel:1",
      "class": "new",
      "kind": "relationship",
      "target": "loja.pedidos-access-loja.pedidos-pedidos-db",
      "from": "loja.pedidos",
      "to": "loja.pedidos-pedidos-db",
      "type": "uses"
    },
    {
      "n": 10,
      "key": "rel:2",
      "class": "new",
      "kind": "relationship",
      "target": "ext.pagamentos-serving-loja.pedidos",
      "from": "loja.pedidos",
      "to": "ext.pagamentos",
      "type": "uses"
    },
    {
      "n": 11,
      "key": "rel:3",
      "class": "new",
      "kind": "relationship",
      "target": "loja.pedidos-realization-loja.pedidos.api-api-de-pedidos",
      "from": "loja.pedidos",
      "to": "loja.pedidos.api-api-de-pedidos",
      "type": "archimate:realization"
    },
    {
      "n": 12,
      "key": "rel:4",
      "class": "new",
      "kind": "relationship",
      "target": "loja.pedidos-flow-topic.pedido-criado",
      "from": "loja.pedidos",
      "to": "topic.pedido-criado",
      "type": "archimate:flow"
    }
  ],
  "summary": {
    "new": 12
  },
  "blocked": false,
  "errors": []
}
